{
  "id": "bundle-demo-001",
  "observation_id": "obs-demo-001",
  "collected_at": "2026-10-09T10:00:00Z",
  "capture_mode": "short_recording",
  "redaction": {
    "performed": true,
    "policy_version": "demo-policy-0",
    "notes": [
      "仅使用虚构演示数据。"
    ]
  },
  "actions": [
    {
      "id": "ev-action-01",
      "time": "2026-10-09T10:00:01Z",
      "description": "点击“继续付款”按钮",
      "locator": "[data-testid='continue-payment']"
    }
  ],
  "network": [
    {
      "id": "ev-network-01",
      "time": "2026-10-09T10:00:02Z",
      "method": "POST",
      "url_redacted": "https://example.invalid/api/payment/prepare",
      "status": 500,
      "duration_ms": 405
    }
  ],
  "console_errors": [],
  "screenshots": [
    {
      "id": "ev-screen-01",
      "time": "2026-10-09T10:00:04Z",
      "artifact_ref": "demo://screenshots/loading.png",
      "description": "虚构截图引用占位符（无实际图片）"
    }
  ],
  "capture_gaps": [
    "无后端 Trace 证据",
    "截图引用仅作演示，无法访问实际文件"
  ]
}
